{
  "type": "derived_from",
  "from": [
    {
      "type": "knowledge",
      "id": "knowledge-derived-a"
    },
    {
      "type": "knowledge",
      "id": "knowledge-derived-b"
    }
  ],
  "to": [
    {
      "type": "knowledge",
      "id": "knowledge-source-a"
    },
    {
      "type": "knowledge",
      "id": "knowledge-source-b"
    }
  ],
  "metadata": {
    "core": {
      "schema": "patchouli.knowledge-relation@1",
      "scope": {
        "tenant": null,
        "workspace": "patchouli",
        "user": "user-42",
        "session": null
      },
      "origin": {
        "provider": "local",
        "binding": "deepseek-harness",
        "native_type": null,
        "native_id": null,
        "native_revision": null
      },
      "time": {
        "event_at": null,
        "source_created_at": null,
        "source_updated_at": null,
        "observed_at": "2026-08-14T08:01:00Z",
        "ingested_at": "2026-08-14T08:01:01Z"
      },
      "lifecycle": {
        "status": "active",
        "expires_at": null
      },
      "provenance": [
        {
          "kind": "derived",
          "actor": "algorithm:knowledge-consolidate@1",
          "source": "operation:op-7",
          "recorded_at": "2026-08-14T08:01:00Z"
        }
      ]
    },
    "extensions": {}
  }
}
